skill_id,skill_name,repo_name,repo_url,skill_url,category,installs,leaderboard_rank,is_official,github_stars_abbreviated,snyk_status,socket_status,agent_trust_hub_status,summary,has_skill_md,scope,procedural,analytical,orchestration,compliance,documentation,explicitness,documentation_quality,tacit_dependency,context_sensitivity,codifiability_score,codifiability_rationale,coordination_burden,evaluation_type,output_verifiability,tests_quality,thresholds_quality,error_handling,evaluability_score,evaluability_rationale,requires_memory,requires_tools,requires_external_services,provenance_clarity,maintenance_signals,safety_notes,scope_limits,coding_status,audit_confidence,coding_notes
PM02,to-prd,mattpocock/skills,https://github.com/mattpocock/skills,https://www.skills.sh/mattpocock/skills/to-prd,project-management,116430,82,N,95.3K,pass,pass,pass,Turn the current conversation context into a PRD and publish it to the project issue tracker. Use when user wants to create a PRD from the current context.,Y,multi_step_workflow,4,3,3,1,4,4,3,2,3,3,"SKILL.md provides a clear, ordered process (explore repo → sketch modules and confirm with user → write PRD and publish) plus a full PRD template with section-by-section instructions (e.g., extensive numbered user stories, implementation/testing decisions, out-of-scope). However, it depends on local project context (domain glossary, ADRs, issue tracker + triage labels, and running `/setup-matt-pocock-skills` if vocabulary not provided), and requires some judgement in synthesizing conversation/codebase understanding into decisions and scope.",3,holistic,2,0,1,0,1,"The artefact specifies the PRD structure and some qualitative constraints (e.g., “A LONG, numbered list of user stories”, “Do NOT include specific file paths or code snippets”, apply `ready-for-agent` label), but it does not define objective acceptance checks, tests, or measurable thresholds for completeness/quality beyond these prose guidelines. No failure modes or recovery steps are described for missing setup, publishing errors, or label/issue-tracker problems.",0,1,1,2,0,1,3,complete,3,Requires repo exploration and publishing to an issue tracker (implies tool use and external service). Mentions setup command `/setup-matt-pocock-skills` and reliance on provided triage label vocabulary; no explicit error-handling if not provided beyond ‘run setup’. Evaluation largely depends on human judgement of PRD quality; only a few hard constraints (no file paths/snippets; apply label).
PM03,gws-tasks,googleworkspace/cli,https://github.com/googleworkspace/cli,https://www.skills.sh/googleworkspace/cli/gws-tasks,project-management,20490,407,Y,88,Pass,Pass,Pass,Google Tasks: Manage task lists and tasks.,Y,single_bounded_task,3,1,2,1,0,3,2,1,3,2,"The SKILL.md provides a clear command pattern (`gws tasks <resource> <method> [flags]`), enumerates available resources/methods, and gives a concrete discovery workflow using `gws tasks --help` and `gws schema tasks.<resource>.<method>` to construct `--params`/`--json`. However, execution depends on external shared instructions for auth/security (`../gws-shared/SKILL.md`) and on the Google Workspace CLI environment, making it context-bound despite relatively low tacit judgement required for basic use.",2,objective,3,0,0,0,1,"Outputs are API-driven and thus largely verifiable by re-running `get/list` after `insert/update/delete` operations, but the artefact provides no explicit tests, acceptance thresholds, or failure/recovery guidance. Evaluation is therefore mostly implicit/objective via API responses rather than codified validation steps in the skill text.",0,1,1,3,1,1,1,complete,3,"Prerequisite points to `../gws-shared/SKILL.md` for auth/security rules (not included here), so safety notes and some operational constraints may exist outside this artefact. No explicit error handling, rate-limit guidance, or validation steps beyond command discovery. Version present in frontmatter (0.22.5); no changelog/update notes in SKILL.md."
PM04,lark-task,larksuite/cli,https://github.com/larksuite/cli,https://www.skills.sh/larksuite/cli/lark-task,project-management,147006,60,N,88,Pass,Pass,Pass,飞书任务：管理任务、清单和任务智能体。创建待办任务、查看和更新任务状态、拆分子任务、组织任务清单、分配协作成员、上传任务附件、注册或注销任务智能体、更新任务智能体的主页数据、写入智能体任务记录。当用户需要创建待办事项、查看任务列表、跟踪任务进度、管理项目清单或给他人分配任务、为任务上传附件文件、注册注销任务智能体、更新…,Y,multi_step_workflow,3,2,3,2,1,3,3,2,3,2,"SKILL.md provides concrete operational guidance (e.g., mandatory pre-read of shared auth/permission handling, decision rules for when to use +search vs list shortcuts, and CLI usage patterns like running `lark-cli schema ...` before calling APIs). It also includes substantial supporting material (shortcut index, API resource map, and a detailed scope/permission table), but execution still depends on external context (Feishu/Lark tenant, auth scopes, user identity resolution, local timezone rendering) and some judgement (interpreting user intent and choosing the right shortcut).",3,objective,3,0,2,0,1,"Outputs are largely verifiable via API/CLI responses (e.g., task URLs, returned fields) and the skill specifies several hard constraints (due required for repeat/reminder; start<=due; GUID vs displayed task number; timezone formatting), enabling objective checks. However, no tests or validation scripts are described in SKILL.md, and there is no explicit failure-mode or recovery guidance beyond the constraints and cautions.",0,1,1,3,1,2,1,complete,3,"Requires `lark-cli` binary (metadata.requires.bins) and implicitly Lark/Feishu APIs + authentication (explicitly points to ../lark-shared/SKILL.md for auth/permissions). Strong context dependence on Feishu task OpenAPI concepts (scopes table, GUID semantics, tenant_access_token limitation). Evaluation is mostly via deterministic API results/constraints; no explicit test harness or error-handling section in this SKILL.md."
PM05,my-pull-requests,github/awesome-copilot,https://github.com/github/awesome-copilot,https://www.skills.sh/github/awesome-copilot/my-pull-requests,project-management,9750,803,Y,33.4K,pass,pass,pass,List my pull requests in the current repository,Y,single_bounded_task,4,1,3,0,0,4,3,1,2,3,"SKILL.md provides concrete, executable steps (find the bundled script, run `node ""$SKILL_SCRIPT"" ""<query>"" ""<role>""`) plus explicit parameter defaults and a role keyword mapping table, making the core procedure highly explicit. Codifiability is reduced slightly by reliance on local Copilot skill installation paths and GitHub CLI authentication state (environment-specific prerequisites), though the date-range parsing is delegated to the script with supported formats listed.",2,objective,3,0,1,2,2,"The outcome is reasonably verifiable by observing that a GitHub PR dashboard opens for the requested date range/role and that stdout shows progress; errors are surfaced via the script’s stderr/stdout. However, no tests or formal acceptance thresholds are provided beyond defaults for `<query>`/`<role>`, and error guidance is limited to suggesting `gh auth login` for auth issues.",0,1,1,2,0,0,1,complete,3,"Evidence: prerequisites explicitly require `gh` installed/authenticated; instructions use `find ~/.copilot ... pr-dashboard-cli.mjs` then `node` to run; includes examples table, role keyword mapping, supported date formats, and minimal error recovery guidance (show error output; suggest `gh auth login`). No visible tests, changelog/versioning, or safety/limitations beyond brief scope description."
PM06,my-issues,github/awesome-copilot,https://github.com/github/awesome-copilot,https://www.skills.sh/github/awesome-copilot/my-issues,project-management,9593,810,Y,33.4K,pass,pass,pass,List my issues in the current repository,Y,end_to_end_process,4,2,3,0,1,4,4,1,3,3,"SKILL.md provides a concrete workflow (determine action → gather context → structure content via referenced templates → execute via MCP reads and `gh api` writes → confirm URL) plus specific command patterns for create/update/comment/close and optional parameters, making the procedure highly explicit. It also includes multiple worked examples, label tables, and links to several reference files for extended capabilities, indicating strong supporting documentation. However, execution is context-bound to GitHub tooling (`@modelcontextprotocol/server-github`, `gh api`, repo/org identifiers) and assumes minor judgement in choosing templates/labels and gathering missing info.",3,objective,3,0,2,1,2,"Outputs are largely verifiable by checking GitHub state (issue created/updated, URL returned; `--jq '{number, html_url}'` suggests concrete confirmation), but no tests or validation scripts are described. Some acceptance-style criteria appear in the feature request example checklist and title/body guidelines, yet they are not formal pass/fail thresholds for the skill overall. Failure modes and recovery are only lightly addressed (e.g., ""Ask for missing critical information rather than guessing"").",0,1,1,2,0,0,1,complete,3,"Although the sampled skill is named ""my-issues"" with summary ""List my issues"", the SKILL.md content is a broader ""GitHub Issues"" management skill covering create/update/query and projects; coded to the provided SKILL.md evidence. No explicit install/auth steps shown, but reliance on MCP GitHub server and `gh api` implies tools + external GitHub service/credentials. Provenance limited to frontmatter name/description; no version/license/author in SKILL.md."
PM07,product-manager-toolkit,sickn33/antigravity-awesome-skills,https://github.com/sickn33/antigravity-awesome-skills,https://www.skills.sh/sickn33/antigravity-awesome-skills/product-manager-toolkit,project-management,2683,2016,N,38.0K,pass,pass,pass,"Essential tools and frameworks for modern product management, from discovery to delivery.",Y,end_to_end_process,3,3,2,1,2,3,4,3,2,3,"SKILL.md provides concrete workflows (prioritization, discovery, PRD) and runnable CLI examples for scripts (e.g., `python scripts/rice_prioritizer.py features.csv --capacity 20`, interview analyzer), plus embedded frameworks/templates (RICE formula, interview guide, PRD template descriptions), making the know-how substantially externalized. However, several steps require human judgement and organizational context (e.g., scoring Reach/Impact/Confidence, “validate against strategy,” stakeholder alignment, and interpreting interview insights), and the “Integration Points” imply dependence on existing PM tool ecosystems.",3,hybrid,2,0,1,0,1,"Some outputs are partially checkable (e.g., RICE score computation and structured outputs like text/json/csv are in principle verifiable), and PRDs call for “clear acceptance criteria” and success metrics, but SKILL.md does not specify concrete pass/fail thresholds or provide tests/validation procedures for the scripts. Interview analysis and PRD quality remain largely judgement-based despite suggested metrics and best practices.",0,1,0,3,1,2,3,complete,3,"Evidence includes YAML frontmatter (name/source/date_added/risk), multiple detailed sections with templates and command examples. No explicit test suite, error modes, or acceptance thresholds beyond general guidance (e.g., include acceptance criteria; limitations advise expert review). External services are mentioned only as potential integration points, not as required dependencies/credentials."
PM08,standup,anthropics/knowledge-work-plugins,https://github.com/anthropics/knowledge-work-plugins,https://www.skills.sh/anthropics/knowledge-work-plugins/standup,project-management,2335,2289,Y,12.3K,pass,pass,pass,"Generate a standup update from recent activity. Use when preparing for daily standup, summarizing yesterday's commits and PRs and ticket moves, formatting work…",Y,single_bounded_task,3,2,3,0,2,3,3,2,2,3,"SKILL.md provides a clear usage pattern (run `/standup` or provide a short natural-language activity summary) and a concrete output template with Yesterday/Today/Blockers, plus conditional instructions for connected tools (source control/project tracker/chat). However, key decisions like how far back to pull activity, how to select “relevant” discussions, and what counts as “high level” summarization are left to judgement, and the “connectors” behavior depends on the user’s specific tool setup (via CONNECTORS.md).",2,holistic,1,0,0,0,0,"The artefact specifies a markdown structure for the standup update, but it does not define correctness criteria for content selection or summarization quality (e.g., relevance/coverage), nor does it include tests, acceptance thresholds, or failure-mode guidance if connectors are missing or data is incomplete.",0,0,0,2,0,0,1,complete,3,"Connectors are referenced and conditional (“If connectors available”), but SKILL.md does not enumerate specific services/credentials here; coded requires_external_services=0 per binary evidence rule. Some boundary guidance implied by “STANDALONE (always works)” vs “SUPERCHARGED,” but no explicit escalation or out-of-scope handling."
PM09,performance-review,anthropics/knowledge-work-plugins,https://github.com/anthropics/knowledge-work-plugins,https://www.skills.sh/anthropics/knowledge-work-plugins/performance-review,project-management,1247,3562,Y,12.3K,pass,pass,pass,"Structure a performance review with self-assessment, manager template, and calibration prep. Use when review season kicks off and you need a self-assessment…",Y,single_bounded_task,3,2,1,1,4,4,3,2,1,3,"The skill provides highly explicit, ready-to-use markdown templates for three modes (self-assessment, manager review, calibration) and specifies invocation patterns and a default behavior when no mode is given. Supporting material includes concrete tips and optional connector-based enrichment guidance, but successful use still depends on human judgement to supply accurate examples, ratings, and justifications, and it is only lightly environment-dependent (connectors are optional).",1,holistic,1,0,1,0,1,"Evaluation is mainly qualitative: the outputs are narrative/templates whose quality depends on specificity and appropriateness rather than deterministic correctness, and no tests or validation steps are described. The only quasi-thresholds are illustrative targets in the calibration rating distribution table (e.g., ~15–20%), but they are not framed as pass/fail acceptance criteria.",0,0,0,2,0,0,1,complete,4,"Evidence: clear modes and usage block; three full markdown output templates; optional connector notes (HRIS/project tracker) are conditional and not required; tips provide qualitative guidance but no explicit acceptance criteria, tests, or failure-mode handling."
PM10,evaluating-candidates,refoundai/lenny-skills,https://github.com/refoundai/lenny-skills,https://www.skills.sh/refoundai/lenny-skills/evaluating-candidates,project-management,1216,3630,N,936,pass,pass,pass,"Help users make better hiring decisions. Use when someone is evaluating job candidates, making hiring decisions, conducting reference checks, reviewing work…",Y,multi_step_workflow,3,4,2,1,1,3,3,3,2,2,"SKILL.md provides a clear interaction procedure (""How to Help"" steps 1–4) plus a sizable set of named principles and diagnostic questions, making the main flow reusable. However, applying the principles (e.g., assessing ""world-class strength,"" ""person-product fit,"" and interpreting reference checks) requires substantial human judgement and role-specific context, and the artefact does not provide concrete rubrics/templates beyond suggestions, limiting full execution reliability.",2,holistic,1,0,0,0,0,"The skill’s outputs are advisory (principles, suggested questions, process structuring) with no explicit acceptance criteria, tests, or pass/fail thresholds in SKILL.md; quality is mainly judged by human usefulness and decision support. No failure modes (e.g., conflicting signals, missing references, bias detection escalation) or recovery procedures are specified.",0,0,0,2,0,1,0,complete,3,"Provenance is limited to frontmatter name/description; no author/version/license in SKILL.md. Safety/limitations only indirectly implied via bias warnings (""Avoid pedigree shortcuts,"" ""Challenge their assumptions"") but no explicit risk, legal, or fairness guidance; coded conservatively."
DM01,pdf,anthropics/skills,https://github.com/anthropics/skills,https://www.skills.sh/anthropics/skills/pdf,document-management,110774,87,Y,137.6K,fail,pass,pass,"Use this skill whenever the user wants to do anything with PDF files. This includes reading or extracting text/tables from PDFs, combining or merging multiple…",Y,multi_step_workflow,4,1,3,0,1,3,4,1,2,3,"SKILL.md provides concrete, reusable code/CLI recipes for many PDF operations (merge/split/rotate/extract/OCR/encrypt) and a task→tool quick-reference table, making the core procedures largely explicit. It also points to additional artefacts (REFERENCE.md, FORMS.md) for advanced/form-filling cases, implying some dependence on external docs and environment-specific setup (Python libs and CLIs like qpdf/pdftotext). Minor tacit judgement remains around choosing the right tool/settings for a given PDF and troubleshooting edge cases not specified here.",2,objective,3,0,0,0,1,"Many outputs are inherently checkable (e.g., merged/split/rotated PDFs, extracted text files, encrypted/decrypted PDFs) via opening files or inspecting page counts/content, but the artefact provides no explicit tests, acceptance thresholds, or validation steps. There is also no described failure-mode handling (e.g., OCR quality checks, corrupted PDFs), so evaluation is possible in principle but not operationalised in the skill text.",0,1,0,3,0,1,1,complete,3,"Evidence: YAML header includes name/description/license; extensive code blocks for pypdf/pdfplumber/reportlab and CLI tools (pdftotext/qpdf/pdftk/pdfimages); notes a specific ReportLab pitfall (Unicode sub/superscripts) as a limitation. No visible tests/thresholds/error recovery guidance; external docs referenced (REFERENCE.md, FORMS.md) but not included in provided content."
DM02,docx,anthropics/skills,https://github.com/anthropics/skills,https://www.skills.sh/anthropics/skills/docx,document-management,96016,116,Y,137.6K,pass,pass,pass,"Use this skill whenever the user wants to create, read, edit, or manipulate Word documents (.docx files). Triggers include: any mention of 'Word doc', 'word…",Y,multi_step_workflow,4,1,3,0,2,4,4,1,2,3,"SKILL.md provides highly explicit, stepwise procedures for multiple DOCX operations (e.g., “Follow all 3 steps in order” for unpack→edit XML→pack; concrete CLI commands; and extensive docx-js code patterns plus “CRITICAL” rules). Supporting material is rich (tables of DXA sizes, many code snippets, XML templates for tracked changes/comments/images, and a Dependencies section), reducing reliance on tacit know-how. Some context sensitivity remains because execution assumes specific tooling and repo scripts (e.g., `scripts/office/unpack.py`, `validate.py`, LibreOffice/pandoc/docx-js).",3,objective,3,1,2,2,2,"Outputs are fairly verifiable because the artefact specifies validation (`python scripts/office/validate.py doc.docx`) and schema/structure constraints (e.g., element order rules, comment marker placement, width-sum invariants for tables). However, there are no test suites described beyond validation and some checks are advisory (“Common Pitfalls”, “Auto-repair will fix/won’t fix”) rather than formal pass/fail thresholds across all tasks.",0,1,0,3,0,1,3,complete,4,"Tooling is explicitly required (pandoc, npm `docx`, LibreOffice via `soffice.py`, Poppler `pdftoppm`, and multiple `scripts/...` utilities). Evaluation is mainly via validation and structural invariants; no broader automated tests or quality thresholds for document aesthetics beyond prescriptive rules. Scope limits are clearly stated in the front-matter description (do not use for PDFs/spreadsheets/Google Docs/general coding)."
DM03,obsidian-markdown,kepano/obsidian-skills,https://github.com/kepano/obsidian-skills,https://www.skills.sh/kepano/obsidian-skills/obsidian-markdown,document-management,33672,309,N,32.1K,pass,pass,pass,"Create and edit Obsidian Flavored Markdown with wikilinks, embeds, callouts, properties, and other Obsidian-specific syntax. Use when working with .md files in…",Y,single_bounded_task,3,1,1,0,4,4,4,1,2,3,"SKILL.md provides a clear stepwise workflow for creating an Obsidian note (frontmatter → content → links → embeds → callouts → verify render) and then enumerates Obsidian-specific syntaxes with concrete code examples (wikilinks, embeds, callouts, properties, tags, comments, math, mermaid, footnotes) plus a complete end-to-end example note. Tacit dependence is low because the syntax rules are largely explicit, but it assumes baseline Markdown knowledge and depends on the Obsidian environment/features (e.g., reading view rendering, vault wikilinks, properties).",2,hybrid,3,0,1,0,1,"Evaluation is mostly by inspection: the workflow explicitly says to ""Verify the note renders correctly in Obsidian's reading view,"" and many outputs are checkable against the provided syntax examples (e.g., `[[...]]`, `![[...]]`, YAML frontmatter). However, there are no automated tests, no explicit pass/fail acceptance thresholds beyond correct rendering, and no failure-mode or recovery guidance.",0,0,0,2,0,0,2,complete,3,"Provenance in SKILL.md is limited to name/description frontmatter; no author/version/license noted there (repo metadata not used for this variable). Scope boundary stated as ""covers only Obsidian-specific extensions"" and assumes standard Markdown knowledge; otherwise few explicit out-of-scope/escalation rules. No explicit tool/service requirements in SKILL.md; Obsidian is implied context rather than a declared dependency."
DM04,gws-sheets,googleworkspace/cli,https://github.com/googleworkspace/cli,https://www.skills.sh/googleworkspace/cli/gws-sheets,document-management,27499,338,Y,26.4K,warn,pass,pass,Google Sheets: Read and write spreadsheets.,Y,single_bounded_task,4,1,3,1,0,3,3,2,3,2,"SKILL.md provides a clear CLI invocation pattern (`gws sheets <resource> <method> [flags]`), a structured list of resources/methods, and a concrete discovery workflow using `gws sheets --help` and `gws schema sheets.<resource>.<method>` to construct `--params`/`--json`. However, execution depends on external prerequisite documentation for auth/security rules (`../gws-shared/SKILL.md`) and on the Google Sheets API semantics, making it context-bound and requiring some implicit judgement when mapping desired operations to resource/method/parameters.",2,none_visible,2,0,0,1,1,"The artefact describes API methods and notes one failure behavior for `batchUpdate` (invalid request causes whole request to fail), but it does not specify acceptance criteria, tests, or validation steps for outputs. Outputs are partially verifiable in principle (e.g., by re-reading sheet values), yet no such verification procedure is included in SKILL.md.",0,1,1,3,2,2,1,complete,3,Evidence: frontmatter includes name/description/version (0.22.5) and requires `gws` binary; prerequisite points to shared SKILL.md for auth/security rules (counted as safety notes but details not visible here). No explicit install command shown in SKILL.md. Scope treated as single bounded task: a generic interface to Sheets API calls rather than an end-to-end business process.
DM05,obsidian-cli,kepano/obsidian-skills,https://github.com/kepano/obsidian-skills,https://www.skills.sh/kepano/obsidian-skills/obsidian-cli,document-management,29680,324,N,88,Pass,Pass,Warn,"Interact with Obsidian vaults using the Obsidian CLI to read, create, search, and manage notes, tasks, properties, and more. Also supports plugin and theme…",Y,multi_step_workflow,4,1,3,0,1,3,3,2,3,2,"SKILL.md provides concrete CLI usage guidance (parameters vs flags, quoting, multiline escapes), targeting rules (file/path, vault selection), and many runnable command examples plus a step-by-step plugin dev/test cycle. However, it depends on an existing local environment (""Requires Obsidian to be open"" and a running instance) and assumes user-specific vault names/files and Obsidian conventions (e.g., wikilink-style file resolution), leaving some execution details to situational judgement.",2,hybrid,3,0,0,2,1,"Outputs are often directly checkable by reading/searching notes or inspecting dev outputs (e.g., `read`, `search`, `dev:dom`, `dev:screenshot`), but the artefact includes no formal tests or acceptance thresholds. Some recovery guidance exists in the plugin workflow via checking `dev:errors` and iterating after reload, yet broader failure modes (e.g., CLI not connected, vault not focused) are not systematically covered.",0,1,0,2,0,0,1,complete,3,Tooling/environment dependency is explicit (Obsidian must be open; targets most recently focused vault). Evaluation is mostly via inspecting CLI outputs and app state; no tests/thresholds mentioned. Provenance limited to frontmatter name/description; no version/license/changelog in SKILL.md.
