skill_id,skill_name,repo_name,repo_url,skill_url,category,installs,leaderboard_rank,is_official,github_stars_abbreviated,snyk_status,socket_status,agent_trust_hub_status,summary,has_skill_md,scope,procedural,analytical,orchestration,compliance,documentation,explicitness,documentation_quality,tacit_dependency,context_sensitivity,codifiability_score,codifiability_rationale,coordination_burden,evaluation_type,output_verifiability,tests_quality,thresholds_quality,error_handling,evaluability_score,evaluability_rationale,requires_memory,requires_tools,requires_external_services,provenance_clarity,maintenance_signals,safety_notes,scope_limits,coding_status,audit_confidence,coding_notes
CC07,baoyu-image-gen,jimliu/baoyu-skills,https://github.com/jimliu/baoyu-skills,https://www.skills.sh/jimliu/baoyu-skills/baoyu-image-gen,content-creation,22375,382,N,18.9K,pass,pass,pass,"[Deprecated: use baoyu-imagine] AI image generation with OpenAI, Azure OpenAI, Google, OpenRouter, DashScope, Z.AI GLM-Image, MiniMax, Jimeng, Seedream and…",Y,single_bounded_task,4,1,3,0,1,4,4,1,2,3,"SKILL.md provides a highly explicit, stepwise procedure including a blocking “Step 0: Load Preferences” with exact file search paths for EXTEND.md, a first-time setup reference, and detailed CLI usage/options/env-var precedence, making the core execution flow reproducible. Supporting material is extensive (tables for options, env vars, provider selection, quality presets, aspect ratios, and multiple referenced guides/schemas), reducing ambiguity. Some tacit/context dependence remains due to reliance on external providers’ evolving quirks and local runtime tool equivalents (e.g., substituting AskUserQuestion variants; provider-specific behavior).",3,objective,3,0,2,3,2,"Outputs are fairly verifiable because the skill produces concrete image files/JSON and specifies deterministic constraints (supported aspect ratios, provider/ref compatibility rules, env/CLI precedence) plus batch success/failure counts and per-image failure reasons. However, no tests or validation scripts are mentioned in SKILL.md. Some acceptance criteria are implicit/partial (e.g., invalid aspect ratio falls back to default; retries up to 3; provider-specific limits), but image “quality” remains largely subjective beyond these checks.",1,1,1,4,2,1,2,complete,4,"Evidence: frontmatter includes name/description/version (1.56.4) and homepage; requires bun/npx. Strong procedural flow: Step 0 blocking EXTEND.md creation; detailed CLI options and env vars; provider selection and batch/sequential rules. External services required via many API keys. Error handling explicitly lists missing key, retries (3), invalid AR fallback, unsupported ref/provider error. Limited safety/guardrails content beyond basic limitations; no explicit tests/CI described. Deprecated notice present but no changelog in SKILL.md (maintenance_signals scored as some due to explicit versioning)."
CC08,baoyu-cover-image,jimliu/baoyu-skills,https://github.com/jimliu/baoyu-skills,https://www.skills.sh/jimliu/baoyu-skills/baoyu-cover-image,content-creation,22059,385,N,18.9K,pass,pass,pass,"Generates article cover images with 5 dimensions (type, palette, rendering, text, mood) combining 11 color palettes and 7 rendering styles. Supports cinematic…",Y,multi_step_workflow,4,2,3,1,1,4,4,1,2,3,"SKILL.md provides a detailed, stepwise workflow (Steps 0–5) with hard gates (e.g., EXTEND.md setup is “⛔ BLOCKING”, confirmation required before generation) plus concrete rules for backend selection and prompt-file creation under prompts/ (including naming and file-structure conventions). Extensive supporting references (templates, presets, auto-selection rules, confirm-options flow, config schema) further externalize know-how; remaining tacit judgement is limited to content analysis/visual metaphor selection in Step 1 and depends somewhat on the runtime’s available image tools and local filesystem conventions.",3,hybrid,2,0,2,2,2,"The artefact defines checkable process/artefact outputs (required prompt file under prompts/, specified directory structure, completion report fields) and some bounded rules (e.g., “Never substitute SVG/HTML”, “Never repair rendered text by painting over a generated bitmap”), but image quality remains partly subjective. No tests are provided; there is limited failure guidance (e.g., “On failure: auto-retry once”, backup existing cover.png) and some concrete thresholds exist mainly as heuristics (e.g., whitespace 40–60%) rather than pass/fail criteria.",1,1,0,4,2,3,3,complete,4,"Requires persistent state via EXTEND.md preferences and reproducibility via saved prompt files. External services/APIs are not explicitly required in SKILL.md (backend could be local/runtime-native), so coded 0 per evidence rule. Strong safety/constraint notes around raster-only generation and prohibitions on SVG/code-based substitutes and bitmap text patching; also includes confirmation policy as a control gate."
CC09,video,coreyhaines31/marketingskills,https://github.com/coreyhaines31/marketingskills,https://www.skills.sh/coreyhaines31/marketingskills/video,content-creation,15630,474,N,29.6K,pass,pass,pass,"When the user wants to create, generate, or produce video content using AI tools or programmatic frameworks. Also use when the user mentions 'video…",Y,end_to_end_process,3,2,3,0,1,3,4,2,2,3,"SKILL.md provides a structured workflow with concrete steps (e.g., “Product Demo Video” and “Explainer Video” numbered sequences) plus tool-selection tables and an agent-native pipeline diagram, making the main flow fairly executable. It also includes substantial supporting material (model/tool comparisons, prompt template, common mistakes, and integration links), but execution still depends on user-specific creative choices (e.g., selecting approach, style, platform fit) and on the user’s stack/assets/API keys, which are gathered via questions.",3,holistic,1,0,0,0,0,"The artefact offers guidance and checklists (e.g., “Common Mistakes,” aspect ratio norms, and prompting do/don’t), but it does not define acceptance criteria, tests, or measurable thresholds for a “good” final video. As a result, output quality is largely judged subjectively (fit to goal/platform, perceived professionalism), with no visible validation or failure/recovery procedures.",0,1,1,3,2,1,2,complete,4,"Evidence: version metadata (2.0.1); explicit preflight step to read product-marketing context file; includes npm install hyperframes and Remotion scaffold command; multiple external services referenced (HeyGen MCP, Veo/Sora/Runway/Kling etc.) implying API keys/paid tools; evaluation guidance is advisory only (no tests/thresholds). Safety/limitations are light (e.g., AI text-in-video unreliability, hallucinated locations, uncanny valley). Scope boundaries present via “Related Skills” routing (social/ad-creative/copywriting) but no escalation rules."
CC10,copy-editing,coreyhaines31/marketingskills,https://github.com/coreyhaines31/marketingskills,https://www.skills.sh/coreyhaines31/marketingskills/copy-editing,content-creation,63712,184,N,88,Pass,Pass,Pass,"When the user wants to edit, review, or improve existing marketing copy, or refresh outdated content. Also use when the user mentions 'edit this copy,' 'review…",Y,multi_step_workflow,4,3,2,0,2,4,4,2,1,3,"The SKILL.md provides a highly structured, sequential procedure (""Seven Sweeps Framework"") with per-sweep focus areas, checklists, and step-by-step processes (e.g., ""Process: 1...4"" for each sweep), plus an additional ""Expert Panel Scoring"" loop with explicit iteration criteria (""iterate until all personas score 7+, with an average of 8+""). Codification is somewhat limited by reliance on editorial judgement (e.g., assessing whether copy ""moves you,"" choosing appropriate proof, and preserving voice) and mild repo-context dependence via optional reading of product marketing context files (e.g., `.agents/product-marketing.md`).",2,hybrid,2,0,3,1,2,"Evaluation is partly formalised via the ""Expert Panel Scoring"" rubric (1–10 meanings) and explicit acceptance thresholds (""all personas score 7+, with an average of 8+"") plus numerous checklist-style criteria, but the core output (improved marketing copy) remains only partially verifiable and depends on human judgement (clarity, tone, emotion). No automated tests or validation scripts are described; failure/recovery guidance is limited to iterative re-checking of prior sweeps rather than explicit error modes.",0,0,0,3,2,0,3,complete,4,"Evidence of strong codification: seven sequential sweeps with explicit per-sweep processes; extensive supporting references (checklist, plain-English alternatives, content refresh). Scope boundaries are stated (edit/refresh existing copy vs rewrite; directs to copywriting/cro). No explicit safety/limitations section beyond general authenticity note; no external services/tools required, aside from optional reading of local context files."
RD01,competitor-profiling,coreyhaines31/marketingskills,https://www.skills.sh/coreyhaines31/marketingskills/competitor-profiling,https://www.skills.sh/coreyhaines31/marketingskills/competitor-profiling,research-and-analysis,17753,445,N,29.6K,warn,pass,pass,"When the user wants to research, profile, or analyze competitors from their URLs. Also use when the user mentions 'competitor profile,' 'competitor research,'…",Y,multi_step_workflow,4,3,3,0,1,4,4,2,2,3,"The SKILL.md specifies a concrete end-to-end procedure (initial assessment questions, three research phases, raw-data persistence rules, and a fixed output structure) including a detailed directory layout and extraction tables per page type. It also provides strong supporting artefacts via referenced templates/tool references and an extensive markdown template, but still requires some analyst judgement for synthesis (e.g., interpreting positioning, strengths/weaknesses, and ""cross-reference claims"") and depends on specific tools and repo context files (Firecrawl, DataForSEO MCP, and optional product-marketing context files).",3,hybrid,2,0,1,1,1,"Outputs are partially checkable because the skill mandates structured markdown profiles, dated snapshots, and a ""Raw Data Sources"" section tied to persisted scrape/SEO/review files, enabling auditability of factual claims. However, there are no explicit tests or pass/fail acceptance criteria beyond general principles (e.g., ""Facts Over Opinions"" and labeling inferences), and little guidance on handling tool/API failures or missing pages beyond optionality (e.g., reviews are ""optional but high-value"").",1,1,1,3,2,0,2,complete,4,Requires Firecrawl and DataForSEO MCP tools (explicitly named) and a repo context file check (.agents/product-marketing.md etc.). Evaluation guidance is mostly qualitative; no concrete thresholds for what counts as sufficient evidence or completeness per section. Version present in frontmatter (2.0.0); updating guidance includes adding a Change Log section but no actual changelog included.
RD02,persona-researcher,googleworkspace/cli,https://www.skills.sh/googleworkspace/cli/persona-researcher,https://www.skills.sh/googleworkspace/cli/persona-researcher,research-and-analysis,14919,492,Y,26.4K,pass,pass,pass,"Organize research — manage references, notes, and collaboration.",Y,multi_step_workflow,3,2,4,0,1,2,2,2,3,2,"SKILL.md provides a short, actionable checklist (Drive organize; Docs +write; Sheets +append; workflow +file-announce; Gmail +send) plus a few concrete tips (e.g., `gws drive files list` search, `--format csv`), but it does not specify folder schemas, naming conventions, or decision rules for what to summarize/log/share. Execution is tightly coupled to the Google Workspace CLI ecosystem via required bins/skills (`gws`, `gws-drive`, `gws-docs`, `gws-sheets`, `gws-gmail`), and some judgement is needed to determine appropriate organization and summary content.",3,holistic,1,0,0,0,0,"The artefact defines activities (organize, write notes/summaries, append logs, announce files, request reviews) but provides no acceptance criteria, tests, or pass/fail thresholds for what counts as a good organization structure or summary. Outputs (notes, folders, announcements) are only loosely verifiable and would mainly require human judgement of usefulness and completeness.",0,1,1,3,2,0,0,complete,3,"Evidence: YAML metadata includes version 0.22.5 and explicit prerequisites/required skills; instructions are bullet-level without detailed schemas or edge cases. No evaluation, error handling, safety, or out-of-scope guidance visible."
RD03,convex-performance-audit,get-convex/agent-skills,https://github.com/get-convex/agent-skills,https://www.skills.sh/get-convex/agent-skills/convex-performance-audit,research-and-analysis,49946,255,N,88,Pass,Pass,Pass,"Audits Convex performance for reads, subscriptions, write contention, and",Y,multi_step_workflow,4,3,3,1,1,4,3,2,3,3,"SKILL.md provides a clear end-to-end audit procedure with ordered steps (""First Step: Gather Signals"", ""Signal Routing"", and Workflow steps 1–5) plus a concrete checklist, making the core execution path explicit. It also points to multiple internal reference files and an external best-practices page, adding reusable supporting material, but effective execution still assumes Convex-specific expertise (e.g., interpreting insights, OCC conflicts, reactive invalidation) and access to a Convex codebase/CLI, making it context-bound.",3,hybrid,2,0,0,2,1,"Evaluation is partly checkable via stated verification items (""Results are the same as before"", ""Eliminated reads or writes are no longer in the path"") and by re-running/consulting insights signals, but no concrete pass/fail thresholds or tests are specified in the artefact. Some failure/uncertainty handling is present (e.g., what to do if CLI is too old; guidance when runtime signals are unavailable), yet acceptance remains partly judgement-based (e.g., deciding when refactors are warranted under the guardrails).",0,1,0,1,0,3,3,complete,3,Requires Convex environment and likely CLI usage (npx convex insights) and codebase inspection; external services/credentials not explicitly required in SKILL.md so coded 0. Provenance beyond name/description in frontmatter not provided (no author/version/license in SKILL.md). Strong guardrails and when-not-to-use sections support safety/scope boundaries; no explicit quantitative performance targets or test harness included.
RD04,architecture-blueprint-generator,github/awesome-copilot,https://www.skills.sh/github/awesome-copilot/architecture-blueprint-generator,https://www.skills.sh/github/awesome-copilot/architecture-blueprint-generator,research-and-analysis,10249,779,Y,33.4K,pass,pass,pass,Comprehensive project architecture blueprint generator that analyzes codebases to create detailed architectural documentation. Automatically detects technology…,Y,end_to_end_process,3,4,2,1,4,4,2,3,2,2,"SKILL.md provides a highly structured, stepwise blueprint for generating a specific artefact ('Project_Architecture_Blueprint.md') with numbered sections (1–17) and conditional branches driven by configuration variables (e.g., PROJECT_TYPE, ARCHITECTURE_PATTERN, DIAGRAM_TYPE), making the core procedure explicit. However, it relies on substantial tacit judgement to correctly infer patterns and rationales from a codebase (e.g., 'determine the architectural pattern(s)' and 'why the current architectural pattern was chosen'), and it is moderately context-sensitive because execution presumes access to and interpretation of a particular codebase and its conventions.",3,holistic,2,0,0,1,1,"The output is a long-form architecture document whose quality is only partially checkable (presence of required sections/diagrams can be verified, but correctness of inferred patterns and decision rationales is largely judgement-based). SKILL.md does not specify tests, acceptance thresholds, or concrete pass/fail criteria for the generated blueprint, and it provides only limited error/failure guidance beyond general prompts like ensuring diagrams reflect implementation.",0,0,0,2,0,0,1,complete,3,"Coded as end_to_end_process because the prompt spans detection, visualization, component/layer/data analysis, testing/deployment architecture, governance, and a 'Blueprint for New Development'. No explicit tooling/API requirements are stated in SKILL.md (diagram generation is requested but no tool named), so requires_tools/external_services left at 0. Provenance limited to frontmatter name/description; no author/version/license noted."
RD05,deep-research,affaan-m/everything-claude-code,https://www.skills.sh/affaan-m/everything-claude-code/deep-research,https://www.skills.sh/affaan-m/everything-claude-code/deep-research,research-and-analysis,3997,1544,N,187.3K,warn,pass,pass,"Multi-source deep research using firecrawl and exa MCPs. Searches the web, synthesizes findings, and delivers cited reports with source attribution. Use when…",Y,multi_step_workflow,3,4,3,1,2,4,4,2,3,3,"SKILL.md provides a clear end-to-end workflow (Steps 1–6) with concrete MCP call examples (e.g., `firecrawl_search`, `web_search_exa`, `firecrawl_scrape`, `crawling_exa`) and a full report template, making the core procedure highly explicit and well-supported. However, it depends on specific external MCP tools and local configuration paths (`~/.claude.json` / `~/.codex/config.toml`) and explicitly warns the skill is “drift-prone” due to changing tool names/quotas/result shapes, increasing context sensitivity and some tacit judgement in source selection/synthesis.",3,hybrid,2,0,2,2,2,"Evaluation is partly checkable via stated quality rules (e.g., “Every claim needs a source,” cross-referencing single-source claims, recency preference) and the required “Sources/Methodology” sections, but correctness of synthesis and theme selection remains partly subjective. No tests or automated validation are provided, and error handling is limited to guidance like acknowledging gaps and stating “insufficient data found,” plus the drift warning to verify MCP configuration/docs.",0,1,1,2,0,3,2,complete,3,Requires Firecrawl/Exa MCP tools (external services) and mentions configuration locations; includes parallelization via Task tool (adds coordination). Safety/limitations evidenced by “Drift-prone skill” warning and “No hallucination/insufficient data” rule. Provenance limited to frontmatter `origin: ECC` without version/license/author details.
RD06,doublecheck,github/awesome-copilot,https://www.skills.sh/github/awesome-copilot/doublecheck,https://www.skills.sh/github/awesome-copilot/doublecheck,research-and-analysis,2864,1913,Y,33.4K,warn,pass,pass,"Three-layer verification pipeline for AI output. Extracts verifiable claims, finds supporting or contradicting sources via web search, runs adversarial review…",Y,multi_step_workflow,4,3,2,1,1,4,4,1,1,4,"SKILL.md provides a highly explicit, stepwise three-layer procedure (Activation modes; Layer 1 claim extraction/consistency/confidence; Layer 2 web_search strategy; Layer 3 adversarial checklist) plus concrete templates for inline verification and the report, making the workflow readily executable. Tacit judgement is limited but present in source credibility assessment and deciding what is “common knowledge” vs needing search; portability is high with only a generic dependency on web search and an internal report template reference.",3,hybrid,3,0,3,2,2,"Outputs are structured and partially checkable: claims are enumerated with IDs, rated using a defined rating rubric (VERIFIED/PLAUSIBLE/UNVERIFIED/DISPUTED/FABRICATION RISK) and accompanied by URLs, enabling spot-checking, but correctness still depends on human review of sources and judgement of authority. No automated tests are specified; however, clear escalation rules (auto-escalate to full report on DISPUTED/FABRICATION RISK; always full report for legal/regulatory content) and a limitations disclosure provide some evaluative guardrails.",1,1,1,2,0,4,3,complete,4,Requires tool/service evidence: Layer 2 explicitly instructs using `web_search` (implies external search service). Persistent “active mode” implies state across conversation (requires_memory=1). Strong safety/limitations section and “not to tell the user what is true” plus limitations disclosure; scope limits via response-type classification and high-stakes auto/full-report rules. Provenance limited to frontmatter name/description; no author/version/license in SKILL.md.
RD07,interpreting-culture-index,trailofbits/skills,https://www.skills.sh/trailofbits/skills/interpreting-culture-index,https://www.skills.sh/trailofbits/skills/interpreting-culture-index,research-and-analysis,2393,2234,N,5.3K,pass,pass,pass,"Interprets Culture Index (CI) surveys, behavioral profiles, and personality assessment data. Supports individual profile interpretation, team composition…",Y,end_to_end_process,3,4,3,2,1,4,4,2,2,3,"SKILL.md provides highly explicit, structured instructions: intake decision tree (JSON vs PDF vs transcript), a routing table to specific workflow files, and a verification loop with concrete checks (e.g., always interpret traits as distance from arrow; compare Survey vs Job). It also includes strong supporting material (tables for distance labels/percentiles, EU utilization formula with thresholds, quick reference trait colors, and an indexed library of references/workflows), but still relies on some interpretive judgement when translating profiles into strengths/challenges and recommendations.",3,hybrid,3,0,3,2,2,"Evaluation is partly objective via embedded criteria and thresholds (e.g., EU utilization formula with 70–130% healthy, >130% stress, <70% frustration; verification checklist items like using relative positions and referencing the arrow) plus qualitative judgement for narrative interpretation and recommendations. No automated tests are described, and error handling is limited to extraction guidance (run `extract_pdf.py --verify`; if uv missing or extraction fails, stop and instruct user rather than using vision).",0,1,0,1,0,3,3,complete,3,Strong in-skill governance: 'When NOT to Use' excludes non-CI instruments and clinical diagnosis; warns against using CI as sole hiring/firing basis; prohibits visual estimation for trait extraction and mandates script verification. Provenance/maintenance details (author/version/license/changelog) not visible in provided SKILL.md excerpt. External services not evidenced; tools evidenced via allowed-tools and `uv run .../extract_pdf.py`.
RD08,academic-search,claude-office-skills/skills,https://www.skills.sh/claude-office-skills/skills/academic-search,https://www.skills.sh/claude-office-skills/skills/academic-search,research-and-analysis,2233,2336,N,137,pass,pass,pass,"Search and analyze academic literature. Find papers, understand research methodologies, and synthesize academic findings for research projects.",Y,multi_step_workflow,3,4,2,0,2,3,4,3,1,3,"SKILL.md provides a clear 3-step usage flow (define topic → get search strategy → analyze findings) plus concrete frameworks (Boolean operators, PICO, three-pass reading) and detailed output templates for search strategies and literature reviews, making the procedure largely externalised. However, high-quality execution still depends on tacit scholarly judgement (e.g., assessing novelty/rigor, identifying themes/gaps, choosing databases/filters), and the skill cannot actually run searches or access full text, limiting end-to-end executability despite good codification.",2,holistic,2,0,1,0,1,"Outputs are mainly narratives and structured plans (search strategy, literature review) that can be checked for completeness against the provided templates and checklists (e.g., “Quality Indicators to Look For”), but correctness of synthesis and gap identification is largely judgement-based. No tests, formal acceptance criteria, or explicit failure/recovery procedures are provided beyond stating limitations (e.g., cannot verify citation counts in real time).",0,1,0,4,1,2,3,complete,3,"Evidence: frontmatter includes name/version/author/license/models and MCP tools (create_docx, extract_text_from_pdf) → requires_tools=1. Strong supporting material: database tables, query examples, analysis frameworks, and two detailed markdown output templates. Evaluability is limited: no explicit pass/fail thresholds beyond a checklist; no test artefacts. Tacit dependency elevated because assessing methodology quality, significance, and synthesising themes/gaps requires domain expertise."
