skill_id,skill_name,repo_name,repo_url,skill_url,category,installs,leaderboard_rank,is_official,github_stars_abbreviated,snyk_status,socket_status,agent_trust_hub_status,summary,has_skill_md,scope,procedural,analytical,orchestration,compliance,documentation,explicitness,documentation_quality,tacit_dependency,context_sensitivity,codifiability_score,codifiability_rationale,coordination_burden,evaluation_type,output_verifiability,tests_quality,thresholds_quality,error_handling,evaluability_score,evaluability_rationale,requires_memory,requires_tools,requires_external_services,provenance_clarity,maintenance_signals,safety_notes,scope_limits,coding_status,audit_confidence,coding_notes
CT03,professional-communication,softaworks/agent-toolkit,https://github.com/softaworks/agent-toolkit,https://www.skills.sh/softaworks/agent-toolkit/professional-communication,communication-tools,3658,1622,N,1.9K,pass,pass,pass,"Guide technical communication for software developers. Covers email structure, team messaging etiquette, meeting agendas, and adapting messages for technical…",Y,multi_step_workflow,3,2,1,0,1,4,4,2,1,3,"SKILL.md provides multiple concrete, reusable frameworks and stepwise templates (e.g., What-Why-How table; email structure template; meeting agenda and summary formats; checklist), making the core guidance highly explicit. It also points to additional reference files (email templates, meeting structures, jargon simplification) and includes many examples, strengthening supporting documentation. Some judgement remains tacit (e.g., calibrating tone, choosing level of detail, “read the room”), but the guidance is broadly portable across common workplace contexts with only minor platform assumptions (Slack/Teams/Discord examples).",2,holistic,1,0,1,0,1,"The artefact offers checklists and structural criteria (clear purpose, key message first, action clear), but these are not formal pass/fail thresholds and do not enable deterministic verification of “good communication.” No tests or validation procedures are described, and there is no failure-mode/recovery guidance beyond general best practices, so evaluation remains primarily human-judgement/holistic.",0,0,0,4,3,0,1,complete,4,Evidence: YAML header includes name/description/allowed-tools; extensive in-doc templates/examples; references to `references/*.md`; explicit Last Updated (2025-12-22) and Version History v1.0.0 (2025-12-26). No explicit safety/limitations section; only minor boundary cues via “When to use” and chat vs email guidance.
CT04,feedback-mastery,softaworks/agent-toolkit,https://github.com/softaworks/agent-toolkit,https://www.skills.sh/softaworks/agent-toolkit/feedback-mastery,communication-tools,3617,1652,N,1.9K,pass,pass,pass,Navigate difficult conversations and deliver constructive feedback using structured frameworks. Covers the Preparation-Delivery-Follow-up model and…,Y,multi_step_workflow,4,2,1,0,1,4,3,2,1,3,"SKILL.md provides a highly structured, stepwise procedure (Preparation–Delivery–Follow-up; three-step delivery formula; checklists; scenario playbooks) plus concrete scripts and a follow-up message template, making the core workflow executable. However, effective use still depends on situational judgement (e.g., selecting appropriate examples, reading emotions, calibrating tone) and the skill is framed for workplace contexts, though not tied to a specific org/toolchain.",2,holistic,1,0,0,1,1,"The artefact offers no tests, acceptance thresholds, or objective success criteria; outcomes like ""positive resolution"" are inherently subjective and context-dependent. It includes some implicit failure avoidance guidance (e.g., ""facts not blame,"" manage emotions, avoid defensiveness) but no explicit error modes or recovery/escalation procedures beyond general follow-up.",0,0,0,2,0,1,1,complete,3,"Evidence is strong for procedural explicitness (multiple numbered steps, checklists, scripts, templates, scenarios). Provenance/maintenance signals are not present in SKILL.md beyond the frontmatter name/description; companion resources are referenced by path but not shown here. Safety/limits are only implicit (e.g., avoid blame/defensiveness); no explicit escalation (e.g., HR/legal) guidance."
CT05,integrate-whatsapp,gokapso/agent-skills,https://github.com/gokapso/agent-skills,https://www.skills.sh/gokapso/agent-skills/integrate-whatsapp,communication-tools,1822,2689,N,114,warn,pass,pass,"Connect WhatsApp to your product with Kapso: onboard customers with setup links, detect connections, receive events via webhooks, and send…",Y,end_to_end_process,4,1,4,1,1,4,4,2,3,3,"SKILL.md provides highly explicit, stepwise procedures for onboarding, webhook setup, messaging, templates, and Flows (e.g., numbered CLI/API sequences, required IDs, flags, and example payloads), plus a detailed file map of scripts/assets/references. Supporting material is extensive (code snippets, JSON examples, rule lists like template rules, troubleshooting, and many linked reference docs). However, execution depends on Kapso-specific tooling and endpoints (Kapso CLI, /platform/v1, /meta/whatsapp/*) and requires some tacit judgement to choose preferred vs fallback paths and resolve integration-specific details (e.g., selecting correct phone_number_id/WABA, webhook event sets).",4,hybrid,3,1,1,2,2,"Outputs are partly verifiable by operational checks (e.g., confirming connected numbers via `kapso whatsapp numbers list/resolve`, webhook test delivery via `node scripts/test.js`, and observing events), but there are no explicit automated test suites or acceptance thresholds described beyond these spot-check commands. Some failure guidance exists (e.g., troubleshooting items like missing flow_token, encryption setup errors, OAuthException 139000), yet systematic error-handling and pass/fail criteria for a “successful integration” are not fully specified.",0,1,1,2,0,2,2,complete,3,"Requires Kapso CLI/Node scripts and Kapso+Meta WhatsApp Cloud API access (API key/env vars). Safety/assurance notes are limited to items like 'Always verify signatures' and some troubleshooting; no explicit security model, rate limits, or data handling policy beyond that. Provenance is limited to frontmatter name/description and repo context; no version/changelog in SKILL.md."
CT06,mom-test,wondelai/skills,https://github.com/wondelai/skills,https://www.skills.sh/wondelai/skills/mom-test,communication-tools,1647,2929,N,1.0K,pass,pass,pass,"Talk to customers without leading them using Mom Test rules: discuss their life not your idea, ask about specifics in the past, and talk less. Use when the…",Y,multi_step_workflow,3,3,1,1,2,4,4,2,1,3,"SKILL.md provides a structured, stepwise framework (rules, good vs bad questions, commitment/advancement, processing) plus concrete copy patterns, tables, and a 0–10 scoring rubric with a stated goal of 10/10, making the core know-how highly explicit. It also links to multiple reference files (e.g., references/question-patterns.md, commitment-advancement.md) and includes examples across contexts, strengthening supporting documentation. Some judgement remains tacit (e.g., interpreting “commitment signals” and scoring adherence in real conversations), but the guidance is broadly portable beyond a specific org/toolchain.",2,hybrid,2,0,3,1,2,"Evaluability is supported by an explicit 0–10 scoring scheme with a target (“Goal: 10/10”) and a quick diagnostic checklist, giving partial, semi-structured criteria for assessing interview scripts/conversations. However, there are no tests or deterministic validation mechanisms, and many outcomes (e.g., whether questions are truly non-leading, whether a commitment is meaningful) require human judgement in context; failure/recovery guidance is limited to general “common mistakes” fixes rather than systematic error handling.",0,0,0,4,2,3,1,complete,4,"Evidence: YAML header includes author and version (1.1.0) and MIT license; explicit scoring rubric (0–10, goal 10/10) and diagnostic table; extensive examples/copy patterns and linked reference files. Maintenance signals limited to presence of version only (no changelog). Safety/ethics boundaries stated repeatedly (e.g., “Never weaponize…”, “Never disguise a sales call…”). Scope limits only lightly indicated via trigger/use-when description and brief pointers to other methods (JTBD/design sprint)."
CT07,discord,steipete/clawdis,https://github.com/steipete/clawdis,https://www.skills.sh/steipete/clawdis/discord,communication-tools,1584,3027,N,373.3K,warn,pass,pass,"Discord message-tool ops: send/read/edit/delete, react, poll, pin, thread, search, presence, media/components.",Y,multi_step_workflow,4,0,2,2,1,4,3,1,3,3,"SKILL.md provides explicit operational rules and concrete JSON payload examples for many actions (send/read/edit/delete/react/poll/pin/thread/search/presence), including required fields like `channel:""discord""`, `to:""channel:<id>""`, and ID preferences, making the core procedure highly executable. However, execution is context-bound to an OpenClaw/Discord setup with config gates (`channels.discord.actions.*`) and a required token (`channels.discord.token`), plus environment-specific IDs.",2,objective,3,0,0,0,1,"Outputs are largely verifiable by observing Discord-side effects (message sent/edited/deleted, reaction added, poll created, presence set) and the request schemas are concrete via JSON examples. No tests, acceptance thresholds, or failure/recovery guidance are described in the skill text.",0,1,1,2,0,1,1,complete,3,"Evidence includes frontmatter with required config `channels.discord.token`, rules about action gates and component/embeds mixing, and multiple concrete JSON examples. No explicit error handling, rate-limit notes, or evaluation/test sections visible; provenance beyond name/description is minimal in SKILL.md."
CT08,slack,steipete/clawdis,https://github.com/steipete/clawdis,https://www.skills.sh/steipete/clawdis/slack,communication-tools,1443,3227,N,373.3K,warn,pass,pass,"Slack tool actions: send/read/edit/delete messages, react, pin/unpin, list pins/reactions/emoji, member info.",Y,single_bounded_task,4,1,2,1,0,4,3,1,3,3,"SKILL.md provides explicit JSON call patterns for each supported action (send/read/react/edit/delete/pin/unpin/listPins/memberInfo/emojiList) plus a clear Inputs section defining required identifiers (channelId, messageId timestamp format, to, emoji), making the core procedure highly executable. However, it is tightly coupled to a configured Slack environment (metadata requires config channels.slack; Slack-specific IDs/timestamps), and includes minor judgement calls (e.g., when context is unclear for deletes).",1,objective,3,0,0,1,1,"Outputs are largely verifiable by observing Slack state changes (message appears/edited/deleted, reaction/pin present, lists returned), but the artefact includes no tests or acceptance thresholds. Error handling is limited to a safety prompt to confirm destructive deletes when context is unclear, with no broader failure-mode guidance.",0,1,1,2,0,3,1,complete,3,Evidence is strong for action schemas and inputs via multiple JSON examples; no visible version/author/license info in SKILL.md beyond frontmatter name/description. External service dependency inferred from Slack tool usage and required config (channels.slack). Scope limits only lightly implied (tool actions listed; no explicit out-of-scope/escalation beyond delete confirmation).
CT09,having-difficult-conversations,refoundai/lenny-skills,https://github.com/refoundai/lenny-skills,https://www.skills.sh/refoundai/lenny-skills/having-difficult-conversations,communication-tools,1197,3687,N,936,pass,pass,pass,"Help users navigate tough feedback, performance conversations, and conflict. Use when someone needs to give hard feedback, have a performance conversation,…",Y,multi_step_workflow,3,2,1,1,0,3,3,3,1,3,"SKILL.md provides a clear 4-step help flow (understand situation, check preparation, choose framework, role-play) plus concrete frameworks and do/don’t guidance (e.g., SBI phrasing, “What did you hear me say?”, termination delivered in private 1:1). However, successful execution still depends heavily on interpersonal judgement and tailoring (e.g., selecting the “right framework,” calibrating tone, handling emotions), which is not fully specifiable, raising tacit dependency. Content is largely portable across orgs, with only light situational assumptions about managerial contexts (performance, firing, promotion).",2,holistic,1,0,0,1,1,"The artefact offers prompts, principles, and common mistakes, but no tests, checklists with pass/fail criteria, or measurable acceptance thresholds for a “good” conversation plan. Some limited recovery guidance exists (e.g., repair via asking “What did you hear me say?”), yet overall quality is mainly judged by human perception of appropriateness and likely conversational outcomes.",0,0,0,2,0,1,1,complete,3,"Provenance is limited to frontmatter name/description and a pointer to `references/guest-insights.md` (no author/version/license in SKILL.md). Safety/limitations are implicit (e.g., termination should be in private 1:1; avoid email) but no broader risk/disclaimer guidance or escalation rules are specified."
CT10,speakturbo-tts,emzod/speak-turbo,https://github.com/emzod/speak-turbo,https://www.skills.sh/emzod/speak-turbo/speakturbo-tts,communication-tools,971,4301,N,18,pass,pass,fail,"Give your agent the ability to speak to you real-time. Talk to your Claude! Ultra-fast TTS, text-to-speech, voice synthesis, audio output with ~90ms latency. 8…",Y,single_bounded_task,4,0,2,0,0,4,4,0,2,4,"SKILL.md provides highly executable CLI procedures (Quick Start, First Run, Usage) with concrete commands, flags, expected outputs (e.g., `ls -lh test.wav  # Should show ~50-100KB file`) and operational details (daemon warm/cold behavior, port 7125, exit codes). Supporting material is extensive: voice table, performance metrics, architecture diagram, troubleshooting steps with expected health-check JSON, and config file format for allowlisted output directories. Transferability is somewhat context-bound due to reliance on local audio playback and a local HTTP daemon on `127.0.0.1:7125`, plus OS-specific playback commands (afplay/aplay).",2,objective,3,0,2,3,2,"Outputs are reasonably verifiable via deterministic checks described in the doc: saving a WAV and checking file size (~50–100KB), querying `curl http://127.0.0.1:7125/health` with an expected JSON shape, and using exit codes (0/1). There are no formal tests mentioned, but there are partial thresholds/expectations (latency ranges, first-run 2–5s, file size) and concrete troubleshooting/recovery actions (check port with `lsof`, restart via `pkill`, view logs).",0,1,0,2,0,2,3,complete,4,Requires local CLI + daemon and local audio stack; no external API/credentials evidenced. Safety/limitations mainly via output path allowlist and config guidance; no broader risk notes. Provenance in SKILL.md limited to name/description frontmatter; no author/version/license info visible.
ET01,recipe-create-classroom-course,googleworkspace/cli,https://github.com/googleworkspace/cli,https://www.skills.sh/googleworkspace/cli/recipe-create-classroom-course,education-and-training,13622,565,Y,26.4K,pass,pass,pass,Create a Google Classroom course and invite students.,Y,single_bounded_task,4,0,2,0,0,4,2,1,3,3,"The SKILL.md provides a clear, executable 3-step procedure with concrete CLI commands and JSON payloads for creating a course, inviting a student, and listing students. However, it assumes a configured Google Workspace/Google Classroom environment and the `gws` CLI plus `gws-classroom` skill loaded (prerequisite + metadata requires), and it leaves placeholders like `COURSE_ID` to be obtained implicitly.",2,objective,3,0,0,0,1,"Outputs are in-principle verifiable by checking whether the course exists, whether an invitation was created, and by listing enrolled students (step 3 provides a direct verification action). No explicit tests, acceptance thresholds, or failure/recovery guidance are described in the artefact.",0,1,1,4,2,0,0,complete,4,"Evidence: metadata includes version 0.22.5 and explicit requires (bin `gws`, skill `gws-classroom`); steps include concrete commands with JSON; verification implied via listing students. No safety, error handling, or out-of-scope guidance present."
ET02,add-educational-comments,github/awesome-copilot,https://github.com/github/awesome-copilot,https://www.skills.sh/github/awesome-copilot/add-educational-comments,education-and-training,8717,896,Y,33.4K,fail,pass,pass,"Add educational comments to the file specified, or prompt asking for file to comment if one is not provided.",Y,single_bounded_task,3,2,1,1,4,4,4,2,1,3,"SKILL.md provides a concrete workflow (Confirm Inputs → Identify File(s) → Review Configuration → Plan Comments → Add Comments → Validate) plus detailed, operational rules (encoding/EOL preservation, QWERTY-only characters, note-numbering, 125% line-count target with caps). Some tacit judgement remains in selecting “which sections…best support the configured learning goals” and interpreting “new or unexpected options…sensibly,” but the constraints and defaults substantially externalize the know-how.",2,objective,3,0,3,2,2,"Evaluation is partly objective because the artefact specifies measurable acceptance criteria (increase total line count to 125% with hard caps; preserve encoding/EOL; avoid syntax errors; keep single-line comments on one line). However, no automated tests are provided, and some quality aspects (educational usefulness, choosing what to comment) remain subjective despite the final checklist and validation step.",0,0,0,2,0,3,2,complete,4,"Strong procedural specification with explicit constraints (125% rule, ≤400 new lines; ≤300 for >1000-line files; preserve encoding/EOL/indentation; do not break execution). No explicit provenance beyond frontmatter name/description; no changelog/version info visible. External URLs listed as references (“Fetch List”) but not required for execution."
ET03,mentoring-juniors,github/awesome-copilot,https://github.com/github/awesome-copilot,https://www.skills.sh/github/awesome-copilot/mentoring-juniors,education-and-training,6428,1233,Y,33.4K,missing,missing,missing,"mentoring-juniors — an installable skill for AI agents, published by github/awesome-copilot.",Y,multi_step_workflow,3,4,2,2,3,4,4,2,1,3,"SKILL.md provides a detailed, phased protocol (Context Gathering → Socratic Questioning → Conceptual Explanation → Progressive Clues → Validation & Feedback) plus concrete loops/templates (PEAR loop, CTEX prompt formula, debriefing and recap markdown templates), making the core execution path highly explicit and reusable. Some judgement remains tacit (e.g., choosing appropriate questions/clue level and assessing learner understanding), but the artefact constrains behavior with “Golden Rules (NEVER broken)” and escalation guidance for total blockage, and it is largely portable beyond minor GitHub Copilot feature references (e.g., /explain, /fix, /tests, @workspace).",2,hybrid,2,0,2,2,2,"Evaluation is partly specified via “Success Metrics” (reasoning ability, dependency reduction, prompt quality, etc.) and a 4-axis review checklist (functional/security/performance/clean code), but these are not operationalized into deterministic pass/fail checks. No tests are provided, and thresholds are mostly qualitative/observational; some failure handling exists through special cases (frustrated learner, wants answer quickly, security issue detected, total blockage with escalation options).",1,0,0,4,0,2,3,complete,4,"Provenance is explicit in frontmatter (name, description, license MIT, authors with GitHub handles). Requires_memory=1 because success metrics include longitudinal change (“session after session”) and templates imply tracking prior attempts/learning; no explicit external service dependency is required despite Copilot references (can be used as guidance without API calls). Safety/limitations: includes security-stop callout and strict mode/escalation; scope limits are clear (“never answers/never complete functional code”, escalation to human mentor)."
ET04,ljg-read,lijigang/ljg-skills,https://github.com/lijigang/ljg-skills,https://www.skills.sh/lijigang/ljg-skills/ljg-read,education-and-training,2044,2461,N,5.1K,warn,pass,pass,"Reading companion agent. Accompanies user through any text (books, articles, essays, papers, news) with translation, structural annotation, deep questioning,…",Y,end_to_end_process,4,4,2,1,2,4,3,3,2,3,SKILL.md给出了从接收文本到Phase 0-4再到写入Org文件的完整分阶段流程，并对翻译三层输出、段落分类([骨]/[肌]/[筋])、提问分支路径等提供了可执行的规则与触发条件（如“点睛层按需触发”的三种情况、碰撞提问三条路）。但“高价值段落”“杀伤力最大的注疏”“真有好东西可比”等关键判断仍依赖较强主观判断，且对WebFetch/Read与本地Org路径等环境有一定依赖，降低可移植性。,3,hybrid,2,0,2,1,1,文档提供了“成功标准（三层）”与可分级的读者回应阈值（如读后一句话L0-L3、至少一次主动行为），使部分结果可被检查，但整体仍以阅读体验与对话质量为主，难以客观判定。未见任何自动化测试/验证脚本；对失败/异常仅有少量原则性表述（如“克制”“读者可覆盖权”），缺少具体故障恢复流程。,1,1,0,3,1,1,2,complete,3,requires_memory=1基于需要跨段落循环推进与最终“理解轨迹/术语表”等汇总；但是否依赖跨会话持久记忆未明。requires_tools=1因明确调用WebFetch/Read与shell date命令并写入本地Org文件路径。requires_external_services保守记0：虽可通过URL抓取，但未明确依赖第三方API/凭证。阈值主要来自L0-L3与行为信号，缺少更细的可操作验收标准。
ET05,academic-writing,jamditis/claude-skills-journalism,https://github.com/jamditis/claude-skills-journalism,https://www.skills.sh/jamditis/claude-skills-journalism/academic-writing,education-and-training,1956,2534,N,213,pass,pass,pass,"Academic writing, research methodology, and scholarly communication workflows. Use when writing papers, literature reviews, grant proposals, conducting…",Y,end_to_end_process,3,3,2,3,2,3,4,2,1,3,"SKILL.md provides extensive, reusable templates and checklists (e.g., FINER criteria, systematic literature search steps, IMRaD section guidance, response-to-reviewers and cover-letter templates, ethics and LLM disclosure checklists), making the know-how highly externalized. However, many steps still require domain judgement (e.g., selecting inclusion/exclusion criteria, interpreting reviewer feedback, choosing journals/OA routes), and some guidance is advisory rather than executable instructions, keeping tacit dependence moderate. The content is largely portable across disciplines with only minor context assumptions (common databases/tools and policy references like Plan S/OSTP).",3,hybrid,2,0,1,1,1,"The artefact offers some checkable criteria and constraints (e.g., FINER checklist, reproducibility test for Methods, ethics/LLM disclosure checklists, and concrete prohibitions like fabricated citations), but it does not define formal acceptance tests or measurable thresholds for most outputs (paper quality, literature review completeness, journal fit). As a result, evaluation is partly criteria-based but still largely dependent on human scholarly judgement and peer review, with no explicit test suite or validation procedure described.",0,0,0,2,0,3,1,complete,3,"Rich SKILL.md with many templates/checklists across research design, writing, peer review, grants, publishing/OA, ethics, and LLM-use disclosure. No explicit tool/API requirements are stated as required (tools/services are listed as options), so requires_tools/external_services coded 0. Some compliance content is present (IRB, COPE/ICMJE, Plan S/OSTP), but no explicit escalation/out-of-scope rules beyond general cautions to verify policies."
